{
  "id": "b8e14c34-6f48-4f74-aca4-12313131313131",
  "title": "My Site",
  "author": "haxtheweb",
  "description": "A series of related material to teach you about the structure of content.",
  "license": "by-sa",
  "metadata": {
    "author": {},
    "site": {
      "name": "mysite",
      "lang": "en",
      "created": 1422799200,
      "updated": 1422799200,
      "settings": {
        "lang": "en-US",
        "publishPagesOn": true,
        "canonical": true
      },
      "tags": [
        "example",
        "outline"
      ]
    },
    "theme": {
      "element": "clean-one",
      "path": "@haxtheweb/clean-one/clean-one.js",
      "name": "Clean one",
      "variables": {
        "hexCode": "#006699",
        "cssVariable": "--simple-colors-default-theme-light-blue-7",
        "icon": "icons:book"
      }
    },
    "platform": {
      "audience": "expert",
      "features": {
        "addPage": true,
        "deletePage": true,
        "outlineDesigner": true,
        "styleGuide": true,
        "insights": true,
        "manifest": true,
        "pageBreak": true,
        "addBlock": true,
        "contentMap": true,
        "viewSource": true,
        "onlineSearch": true
      },
      "allowedBlocks": [
        "p",
        "h2",
        "media-image",
        "video-player"
      ]
    },
    "node": {
      "fields": {}
    }
  },
  "items": [
    {
      "id": "item-1",
      "indent": 0,
      "location": "pages/item-1/index.html",
      "slug": "outline",
      "order": 0,
      "parent": null,
      "title": "Outline",
      "description": "A description at a glance of this item potentially",
      "metadata": {
        "icon": "icons:view-quilt",
        "published": true,
        "hideInMenu": false
      }
    },
    {
      "id": "item-2",
      "indent": 1,
      "location": "pages/item-2/index.html",
      "slug": "introduction",
      "order": 0,
      "parent": "item-1",
      "title": "Introduction to outlines",
      "description": "A description at a glance of this item potentially",
      "metadata": {
        "published": true,
        "hideInMenu": false
      }
    },
    {
      "id": "item-3",
      "indent": 1,
      "location": "pages/item-3/index.html",
      "slug": "a-2nd-page-item",
      "order": 1,
      "parent": "item-1",
      "title": "An item in an outline",
      "description": "A description at a glance of this item potentially",
      "metadata": {
        "published": true,
        "hideInMenu": false,
        "pageType": "Lesson",
        "tags": [
          "outline",
          "example"
        ],
        "relatedItems": [
          "item-2"
        ]
      }
    }
  ]
}
